{
  "contract": "vhos.discovery.capture-session",
  "contract_version": "1.0.0",
  "id": "capture_01K32Q6T000000000000000000",
  "vehicle_id": "veh_01K32Q6T000000000000000001",
  "vehicle_profile_sha256": "03f0fec7ffa21758988d80e8f273e0be6800ff00e4d65be6a4044c71dd847bb2",
  "started_at": "2026-08-18T17:20:27Z",
  "ended_at": "2026-08-18T17:37:45Z",
  "wall_clock_basis": "EVIDENCE_INGESTION_TIME",
  "start_monotonic_microseconds": 2174564,
  "end_monotonic_microseconds": 9106185,
  "gateway": {"gateway_id": "esp32-9454c5b08d14"},
  "gateway_session_ids": [627753796],
  "bus_bitrates_bps": [500000],
  "listen_only": true,
  "retained_record_count": 256,
  "first_source_sequence": 1,
  "last_source_sequence": 3873,
  "archive_sha256": "af2305021c2d48d89c55d1739da407d78ee28baa39cce63125d0656672f58aed",
  "manifest_sha256": "67d788809abe71c5e53c86e9db1b544b95c0f50d10070fc484ed59aafbda0205",
  "event_markers": [],
  "physical_measurements": [],
  "notes": "Materialized from the retained 2026-08-18 gateway evidence fixture.",
  "authority": "OBSERVED"
}
